{
  "schema_version": 1,
  "status": "validated",
  "importer_version": "local-window-catalog-bridge/1",
  "catalog_package_version": "0.2.0",
  "observed_at": "2026-08-26T23:30:00Z",
  "import_batch_id": "imp_11111111111111111111111111111111",
  "result_sha256": "1111111111111111111111111111111111111111111111111111111111111111",
  "result_byte_count": 8192,
  "acquisition_result_sha256": "2222222222222222222222222222222222222222222222222222222222222222",
  "acquisition_import_sha256": "3333333333333333333333333333333333333333333333333333333333333333",
  "acquisition_import_batch_id": "imp_22222222222222222222222222222222",
  "acquisition_processing_run_id": "run_33333333333333333333333333333333",
  "admission_processing_run_id": "run_44444444444444444444444444444444",
  "run_semantics": "catalog_admission_verification_not_extraction_execution",
  "parent_media_id": "media_sha256_4444444444444444444444444444444444444444444444444444444444444444",
  "source_id": "src_55555555555555555555555555555555",
  "window": {
    "window_id": "window_000001",
    "ordinal": 1,
    "start_ms": 0,
    "end_ms": 1800000,
    "boundary": "half_open",
    "is_partial_tail": false
  },
  "time_mapping": {
    "boundary": "half_open",
    "source_start_ms": 0,
    "source_end_ms": 1800000,
    "artifact_zero_maps_to_source_ms": 0,
    "coordinate_precision": "integer_millisecond_contract",
    "extraction_method": "ffmpeg_accurate_seek_transcode",
    "byte_exact_source_fragment": false
  },
  "artifacts": [
    {
      "artifact_id": "artifact_66666666666666666666666666666666",
      "artifact_kind": "window_audio_16khz_mono_flac",
      "media_id": "media_sha256_6666666666666666666666666666666666666666666666666666666666666666",
      "path": "/private/window/audio-16khz-mono.flac",
      "sha256": "6666666666666666666666666666666666666666666666666666666666666666",
      "byte_count": 1000,
      "duration_ms": 1799979,
      "visibility": "private",
      "rendition_contexts": [
        {
          "recording_id": "rec_77777777777777777777777777777777",
          "rendition_id": "rnd_88888888888888888888888888888888"
        }
      ]
    },
    {
      "artifact_id": "artifact_99999999999999999999999999999999",
      "artifact_kind": "window_low_resolution_cfr_proxy",
      "media_id": "media_sha256_9999999999999999999999999999999999999999999999999999999999999999",
      "path": "/private/window/proxy-640x360-25fps.mp4",
      "sha256": "9999999999999999999999999999999999999999999999999999999999999999",
      "byte_count": 2000,
      "duration_ms": 1800022,
      "visibility": "private",
      "rendition_contexts": [
        {
          "recording_id": "rec_77777777777777777777777777777777",
          "rendition_id": "rnd_aaaaaaaaaaaaaaaaaaaaaaaaaaaaaaaa"
        }
      ]
    }
  ],
  "asr_work_order_inputs": [
    {
      "input": {
        "path": "/private/window/audio-16khz-mono.flac",
        "expected_sha256": "6666666666666666666666666666666666666666666666666666666666666666",
        "media_id": "media_sha256_6666666666666666666666666666666666666666666666666666666666666666",
        "artifact_id": "artifact_66666666666666666666666666666666",
        "parent_processing_run_id": "run_44444444444444444444444444444444"
      },
      "catalog_context": {
        "recording_id": "rec_77777777777777777777777777777777",
        "rendition_id": "rnd_88888888888888888888888888888888"
      },
      "window": {
        "offset_ms": 0,
        "duration_ms": null
      },
      "source_time_mapping": {
        "boundary": "half_open",
        "source_start_ms": 0,
        "source_end_ms": 1800000,
        "artifact_zero_maps_to_source_ms": 0,
        "coordinate_precision": "integer_millisecond_contract",
        "extraction_method": "ffmpeg_accurate_seek_transcode",
        "byte_exact_source_fragment": false
      },
      "boundary_calibration_state": "not_calibrated"
    }
  ],
  "statistics": {
    "processing_runs": 1,
    "run_inputs": 2,
    "media_objects": 2,
    "media_locations": 2,
    "media_derivations": 2,
    "artifacts": 2,
    "renditions": 2,
    "timeline_map_spans": 2,
    "publication_decisions": 0,
    "identity_claims": 0
  },
  "safety": {
    "visibility": "private",
    "publication_authority": "none",
    "identity_authority": "none",
    "network_access_performed": false,
    "credentials_used": false,
    "producer_extraction_time_known": false,
    "source_boundary_calibrated": false
  }
}
